{
  "$schema": "http://json-schema.org/draft-07/schema#",
  "title": "MethodologyAtom",
  "description": "A single methodology / knowledge atom card (kind='methodology'). For kind='experience' see experience-atom.schema.json (subKind='crystallized') and experience-fragment.schema.json (subKind='fragment'); for kind='skill-inventory' see skill-inventory-item.schema.json; for kind='profile' (V2.x bootstrap-skill, singleton id=atom_profile_main) see profile-atom.schema.json. Introduced in V1.5: the 'kind' discriminator field. V2.x adds the 'profile' kind via the 2026-04-bootstrap-skill change.",
  "type": "object",
  "required": [
    "id",
    "schemaVersion",
    "kind",
    "name",
    "frameworkId",
    "cellId",
    "tags",
    "coreIdea",
    "whenToUse",
    "aiSkillPrompt",
    "bookmarks",
    "stats",
    "createdAt",
    "updatedAt"
  ],
  "properties": {
    "id": { "type": "string", "pattern": "^atom_[a-z0-9_-]+$" },
    "schemaVersion": { "type": "integer", "const": 1 },
    "kind": {
      "type": "string",
      "const": "methodology",
      "description": "V1.5 discriminator. Must be 'methodology' for this schema. V1 atoms get this backfilled by scripts/migrate-v1-to-v1.5.mjs."
    },
    "name": { "type": "string", "minLength": 1 },
    "nameEn": { "type": "string" },
    "frameworkId": { "type": "string" },
    "cellId": { "oneOf": [{ "type": "integer", "minimum": 1 }, { "type": "string", "minLength": 1 }], "description": "Cell/category/node identifier. Integer for matrix layouts, string for list/tree." },
    "tags": { "type": "array", "items": { "type": "string" } },
    "parentAtomId": { "type": "string" },
    "relationType": { "type": "string", "enum": ["child", "sibling", "parent"] },
    "coreIdea": { "type": "string", "minLength": 1, "maxLength": 500 },
    "whenToUse": { "type": "string", "minLength": 1 },
    "keySteps": { "type": "array", "items": { "type": "string" } },
    "aiSkillPrompt": { "type": "string", "minLength": 1 },
    "example": {
      "type": "object",
      "properties": {
        "title": { "type": "string" },
        "content": { "type": "string" }
      }
    },
    "bookmarks": {
      "type": "array",
      "items": {
        "type": "object",
        "required": ["id", "type", "title", "addedAt"],
        "properties": {
          "id": { "type": "string" },
          "type": { "type": "string", "enum": ["link", "text"] },
          "title": { "type": "string" },
          "url": { "type": "string" },
          "content": { "type": "string" },
          "note": { "type": "string" },
          "addedAt": { "type": "string", "format": "date-time" }
        }
      }
    },
    "role": { "type": "string", "description": "V2.0 · role dimension for unified skeleton grouping" },
    "lastAccessedAt": {
      "type": "string",
      "format": "date-time",
      "description": "V2.x cognitive-evolution · ISO 8601 timestamp passively updated by atomsyn-cli when read/find hits this atom (throttled, only persisted to disk if last update was > 1h ago). Feeds confidence_decay calculation. Optional; absent fallbacks to createdAt."
    },
    "supersededBy": {
      "type": "string",
      "pattern": "^atom_[a-z0-9_-]+$",
      "description": "V2.x cognitive-evolution · Single atom id that supersedes this one. When set, atom is read-only and read/find default-hides it (filter out in index)."
    },
    "supersedes": {
      "type": "array",
      "items": { "type": "string", "pattern": "^atom_[a-z0-9_-]+$" },
      "description": "V2.x cognitive-evolution · Atom ids this atom supersedes (single-direction linked list, multiple ids supported when merging multiple atoms into one)."
    },
    "archivedAt": {
      "type": "string",
      "format": "date-time",
      "description": "V2.x cognitive-evolution · ISO 8601 soft-delete timestamp. read/find default does not return; can be unset via atomsyn-cli archive --restore."
    },
    "archivedReason": {
      "type": "string",
      "maxLength": 500,
      "description": "V2.x cognitive-evolution · Optional user-provided rationale captured when archiving."
    },
    "stats": {
      "type": "object",
      "required": ["usedInProjects", "useCount"],
      "properties": {
        "usedInProjects": { "type": "array", "items": { "type": "string" } },
        "lastUsedAt": { "type": "string" },
        "useCount": { "type": "integer", "minimum": 0 },
        "aiInvokeCount": { "type": "integer", "minimum": 0, "description": "V2.0 · incremented by atomsyn-cli read (agent consumption)" },
        "humanViewCount": { "type": "integer", "minimum": 0, "description": "V2.0 · incremented when user opens atom in GUI" },
        "invokedByAgent": {
          "type": "object",
          "description": "V1.5 · how many times each agent invoked this atom via atomsyn-read. Key = agent name, value = count.",
          "additionalProperties": { "type": "integer", "minimum": 0 }
        },
        "userDemoted": {
          "type": "boolean",
          "description": "V1.5 · T-6.2 calibration action. True means user down-weighted this atom in retrieval ranking."
        },
        "locked": {
          "type": "boolean",
          "description": "V1.5 · T-6.2 calibration action. True means agent write operations cannot mutate this atom."
        },
        "imported": {
          "type": "boolean",
          "description": "V2.x bootstrap-skill · True if this atom was created by atomsyn-cli bootstrap during a batch import session. Lets mentor reports filter or down-weight imported atoms vs hand-crystallized ones."
        },
        "bootstrap_session_id": {
          "type": ["string", "null"],
          "description": "V2.x bootstrap-skill · Source bootstrap session id when imported=true. Null otherwise. Lets the user trace any imported atom back to its origin run."
        }
      }
    },
    "createdAt": { "type": "string" },
    "updatedAt": { "type": "string" }
  }
}
