{
  "id": "atom_growth_mindset",
  "schemaVersion": 1,
  "kind": "methodology",
  "name": "成长型思维",
  "nameEn": "Growth Mindset",
  "frameworkId": "cognitive-psychology-basics",
  "cellId": "learning-theory",
  "tags": ["学习理论", "Carol Dweck", "思维模式", "韧性", "反馈"],
  "coreIdea": "成长型思维（Growth Mindset）由 Carol Dweck 基于 30 年研究提出：持有「能力可以通过努力发展」信念的人（成长型），比持有「能力是固定天赋」信念的人（固定型），更愿意接受挑战、从失败中学习、在困难面前坚持更久。Dweck 的研究表明，仅仅改变对能力的信念——从「我不行」到「我还不行（yet）」——就能显著改变学习行为和成绩。但 Dweck 也警告「虚假成长型思维」：仅仅口头说「我相信努力」而不改变实际行为是无效的。",
  "whenToUse": "团队文化建设和反馈文化 · 绩效评估和 1:1 对话 · 新人入职心态引导 · 产品中的错误处理和鼓励机制 · 教育类产品的激励设计 · 个人面对失败和挫折时的心理调适",
  "keySteps": [
    "识别当前的思维模式：在什么领域你倾向于固定型？什么触发了这种想法？",
    "觉察固定型思维的「声音」：「我就是不擅长这个」「别人比我有天赋」",
    "重新标签：将「失败」重新定义为「学习数据」",
    "将表扬从「你真聪明」改为「你的方法很有效」（过程导向）",
    "设计「安全失败」的环境——让团队可以冒险和犯错",
    "建立努力-进步的可见联系：让每一点进步都被看到和记录",
    "定期回顾成长轨迹：对比 3 个月前的自己，看到变化"
  ],
  "aiSkillPrompt": "你是一位精通 Carol Dweck 成长型思维研究和组织学习理论的心理教练。请按以下流程帮助我培养成长型思维：\n\n## 输入\n{请在此处填入：你当前面临的挑战或挫折、你对这件事的内心想法、你希望改变的思维或行为模式}\n\n## 任务\n1. 思维模式诊断：分析用户描述中的固定型和成长型思维信号——\n   - 固定型信号：「我不行」「我没天赋」「别人比我强」「失败说明我不适合」\n   - 成长型信号：「我还在学」「这次失败教会了我」「我可以换个方法」\n2. 触发场景识别：什么情境最容易激活你的固定型思维？（被批评/与他人比较/面对新挑战/公开犯错）\n3. 重构练习：将 3-5 个固定型想法转化为成长型表达——\n   - 「我不擅长演讲」→「我在演讲方面还有提升空间，上次的进步是 ___」\n   - 「这个项目失败了」→「这个项目教会了我 ___，下次我会 ___」\n4. 环境设计：如何调整你的工作/学习环境来支持成长型思维——反馈方式、目标设定、团队文化\n5. 行动计划：设计一个 30 天的「成长型思维实验」\n\n## 输出格式\n章节 1：思维模式诊断卡片。章节 2：固定型 → 成长型重构清单。章节 3：环境设计建议。章节 4：30 天行动计划。\n\n## 约束\n- 不要盲目乐观——成长型思维不是「只要努力就能成功」，而是「努力是进步的前提」\n- 区分「虚假成长型思维」和真正的成长型思维——口头上说相信努力但行为上回避挑战不算\n- 承认天赋和起点的差异——成长型思维不否认个体差异，而是关注可控的部分\n- 建议要具体到行为层面，不能只是「改变心态」的空话",
  "example": {
    "title": "案例：微软 CEO Satya Nadella 的文化转型",
    "content": "Satya Nadella 2014 年接任微软 CEO 后，将 Carol Dweck 的成长型思维作为公司文化转型的核心理念。他将微软从「know-it-all」（什么都懂）文化转变为「learn-it-all」（不断学习）文化。具体措施包括：取消强制排名绩效评估（减少内部竞争），将「从失败中学到了什么」纳入绩效对话，鼓励跨部门合作而非防御性的知识垄断。这次文化转型被广泛认为是微软从「失去的十年」重回巅峰的关键因素之一——市值从 3000 亿增长到超过 2 万亿美元。"
  },
  "bookmarks": [],
  "stats": {
    "usedInProjects": [],
    "useCount": 0,
    "aiInvokeCount": 0,
    "humanViewCount": 0
  },
  "createdAt": "2026-04-14T00:00:00Z",
  "updatedAt": "2026-04-14T00:00:00Z"
}
