{
  "id": "atom_cognitive-walkthrough",
  "schemaVersion": 1,
  "kind": "methodology",
  "name": "认知走查法",
  "nameEn": "Cognitive Walkthrough Method",
  "frameworkId": "ui-ux-patterns",
  "cellId": "usability",
  "tags": [
    "UX",
    "可用性",
    "认知走查",
    "学习性",
    "任务分析"
  ],
  "coreIdea": "认知走查法由 Cathleen Wharton 和 John Rieman 等人在1990年代初提出，专注于评估界面的“可学习性”（Learnability）。核心方法：评估者站在新用户视角，逐步走查一个任务流程，在每个操作步骤回答四个问题：①用户会尝试达到正确的效果吗？②用户能注意到正确的操作入口吗？③用户能将操作入口与期望效果关联吗？④操作后的反馈能让用户知道进展正确吗？有效原因：聚焦于“探索式学习”场景——大多数用户不读说明书，而是直接尝试。与启发式评估互补，认知走查更擅长发现任务流程中的“断链”问题。",
  "whenToUse": "新产品/新功能的首次使用体验评估 · 新用户引导流程(Onboarding)设计验证 · 复杂任务流程的步骤简化分析",
  "keySteps": [
    "定义用户画像：明确评估对象（新用户还是转换用户，前置知识水平）",
    "任务定义：选择要评估的核心任务，分解为具体操作步骤",
    "准备正确操作序列：记录完成任务的理想步骤路径",
    "逐步走查：在每个步骤回答四个核心问题并记录问题",
    "问题归类：将发现分为可见性问题、关联性问题、反馈问题",
    "设计修改建议：针对每个断链点提出改进方案",
    "复查验证：修改后重新走查确认问题解决"
  ],
  "aiSkillPrompt": "你是一位精通 Wharton-Rieman 认知走查法的 UX 可用性专家。请按以下流程帮助我：\n\n## 输入\n{用户提供的任务描述、界面截图/流程图、目标用户画像（经验水平）}\n\n## 任务\n1. **任务分解**：将目标任务分解为具体操作步骤序列\n2. **四问走查**：在每个步骤执行四问评估（目标/可见性/关联性/反馈）\n3. **断链识别**：标注所有可能导致用户迷失或放弃的步骤\n4. **修复方案**：为每个断链点设计具体改进\n\n## 输出格式\n使用 Markdown 结构化输出：\n- 任务步骤分解表\n- 四问走查矩阵（步骤 | Q1目标 | Q2可见 | Q3关联 | Q4反馈 | 问题描述）\n- 断链热力图（标注高风险步骤）\n- 改进方案列表（步骤 | 问题 | 改进 | 优先级）\n\n## 约束\n- 必须以完全新手视角评估（不假设用户有前置知识）\n- 每个步骤的四个问题必须逐一回答\n- 连续两个失败步骤视为“关键断链”\n- 改进方案必须保持任务总步骤数不增加",
  "example": {
    "title": "案例：Figma 新用户创建第一个设计文件",
    "content": "对 Figma 新用户（无设计工具经验）进行‘创建一个按钮组件’任务的认知走查。步骤3‘选择矩形工具’出现断链：Q2失败——工具栏图标对新手不直观（方形图标可能被理解为“插入图片”）。步骤5‘添加文字’Q3失败——用户不确定要先切换到文本工具还是双击矩形内部。步骤8‘创建组件’是关键断链——右键菜单中‘Create Component’对非英语用户不可见，快捷键Ctrl+Alt+K更是无法被发现。改进方案：增加上下文提示和首次使用引导。修改后新用户任务完成率从43%提升至72%。"
  },
  "bookmarks": [],
  "stats": {
    "usedInProjects": [],
    "useCount": 0,
    "aiInvokeCount": 0,
    "humanViewCount": 0
  },
  "createdAt": "2026-04-14T00:00:00Z",
  "updatedAt": "2026-04-14T00:00:00Z"
}
