{
  "id": "atom_problem_statement",
  "schemaVersion": 1,
  "kind": "methodology",
  "name": "问题陈述画布",
  "nameEn": "Problem Statement Canvas",
  "frameworkId": "design-thinking-5",
  "cellId": 2,
  "tags": [
    "设计思维",
    "问题定义",
    "画布工具",
    "设计挑战",
    "框架化"
  ],
  "coreIdea": "问题陈述画布是一种结构化的问题定义工具，综合了 d.school 的 POV 方法和 Lean UX 的问题假设框架。它将问题定义拆解为五个维度：Who（用户是谁）、What（他们想做什么）、Where/When（在什么场景下）、Why（为什么当前方案不够好）、Impact（如果解决了会怎样）。核心哲学：模糊的问题产生模糊的解决方案。将问题从一句话扩展为五维画布，能帮助团队发现定义中的盲点。好的问题陈述应当「足够窄到可以行动，足够宽到允许创新」。与 POV 相比，画布更结构化，适合跨职能团队达成共识。",
  "whenToUse": "团队对问题定义理解不一致需要对齐 · POV 太抽象需要进一步细化 · 需要向利益相关者清晰传达设计挑战",
  "keySteps": [
    "1. 填写 Who：详细描述目标用户（不只是人口统计，包含行为和心理特征）",
    "2. 填写 What：用户试图完成的任务或达成的目标（用动词表达）",
    "3. 填写 Where/When：问题发生的具体场景和触发条件",
    "4. 填写 Why：当前解决方案为什么不够好（基于用户洞察而非假设）",
    "5. 填写 Impact：解决这个问题会带来什么可衡量的改变",
    "6. 将五维画布浓缩为一段完整的问题陈述（2-3 句话）",
    "7. 用「5 个为什么」检验：团队是否真正理解了问题的根因"
  ],
  "aiSkillPrompt": "你是一位精通设计思维和精益用户体验的问题定义教练。请按以下流程帮助我：\n\n## 输入\n{请提供：产品/服务背景、目标用户、你观察到的用户痛点或机会}\n\n## 任务\n1. 引导填写问题陈述画布的五个维度：\n   - Who：用户画像（行为特征+心理特征，非人口统计）\n   - What：用户的核心任务/目标（用 JTBD 视角的动词短语）\n   - Where/When：问题场景（具体到触发条件和环境因素）\n   - Why：当前方案的不足（区分表层症状和根因）\n   - Impact：解决后的预期效果（可衡量的指标）\n2. 基于画布生成完整的问题陈述段落（2-3 句话）\n3. 用「5 个为什么」深挖根因，检验问题定义是否到位\n4. 评估问题陈述的质量并提出改进建议\n\n## 输出格式\n章节 1：五维画布（Markdown 表格）。章节 2：问题陈述段落。章节 3：5 Why 根因分析。章节 4：质量评估和改进建议。\n\n## 约束\n- What 维度必须用动词表达用户目标，不能是功能描述\n- Why 维度必须基于用户洞察，不能是团队假设\n- Impact 维度必须包含至少一个可衡量的指标\n- 问题陈述不能暗示具体解决方案",
  "example": {
    "title": "案例：Uber Eats 用问题画布重新定义外卖体验问题",
    "content": "Uber Eats 产品团队在 2018 年发现订单取消率居高不下。通过问题陈述画布，团队将问题从「用户取消订单」重新定义为：「独居年轻上班族（Who）在深夜加班后想用最少精力获得一顿满意的晚餐（What），在通勤回家的地铁上下单时（Where/When），因为无法预判到餐时间而频繁取消改下其他店（Why）」。基于这个精确的问题定义，团队推出了「实时预计到达时间+延迟主动通知」功能，订单取消率下降了 18%，用户满意度提升了 25%。"
  },
  "bookmarks": [],
  "stats": {
    "usedInProjects": [],
    "useCount": 0,
    "aiInvokeCount": 0,
    "humanViewCount": 0
  },
  "createdAt": "2026-04-14T00:00:00Z",
  "updatedAt": "2026-04-14T00:00:00Z"
}
