{
  "id": "atom_soft_launch",
  "schemaVersion": 1,
  "name": "软发布",
  "nameEn": "Soft Launch",
  "frameworkId": "product-innovation-24",
  "cellId": 16,
  "tags": [
    "发布",
    "Soft Launch",
    "灰度",
    "区域测试"
  ],
  "parentAtomId": "atom_first_launch_overview",
  "relationType": "child",
  "coreIdea": "在小范围（一个城市、一个国家、一个用户群）静悄悄上线，不做任何 PR，让产品在没有聚光灯下暴露真实问题。等数据稳定再扩大——「先小后大」是降低发布风险的唯一姿势。",
  "whenToUse": "新 App / 新地区扩张 · 想暴露真实留存与崩溃率 · 不确定服务器承载 · 复杂本地化产品 · 多端协同不够稳",
  "keySteps": [
    "选择 1 个低风险市场（次级城市 / 小语言地区 / 内部员工）",
    "禁用全量营销，只用最小流量（自然搜索 / 邮件邀请）",
    "设置流量上限和熔断阈值",
    "监控留存、崩溃率、关键指标 2-4 周",
    "迭代到指标稳定再考虑全量发布",
    "保留「不发布」的勇气：如果数据差就退回 beta"
  ],
  "aiSkillPrompt": "你是一位精通分阶段发布与灰度策略的资深 Growth Lead，熟悉 Supercell、Niantic 等大厂的 soft launch 方法。我会告诉你产品状态与目标市场，请你帮我设计一次完整的软发布方案。\n\n## 输入\n产品类型：{请在此处填入}\n候选发布市场（地区/用户群/平台）：{请在此处填入}\n要在软发布期回答的关键问题：{请在此处填入}\n\n## 任务\n1. 推荐最适合的软发布市场（区域 / 用户群），说明为什么这个市场代表性好且风险可控\n2. 给出软发布期长度建议（2 / 4 / 8 周）及理由\n3. 设计监控指标看板：D1 / D7 / D30 留存基线、Crash-free %、ARPU、NPS\n4. 给出每个指标的「绿/黄/红」三档阈值与对应行动\n5. 列出 5 个软发布期必须做的运营动作（社群、客服、访谈、灰度推送）\n6. 设计「扩量决策树」：什么数据达标后扩到下一个市场\n7. 给出「kill / pause」的红线条件\n8. 写一份内部沟通模板，告诉公司其他部门「为什么我们不大张旗鼓发布」\n\n## 输出格式\n指标看板表 + 决策树 + 沟通模板\n\n## 约束\n- 不允许「先发布看反应」这种没有阈值的方案\n- 必须区分技术指标与业务指标的红线\n- 必须保留 kill 选项",
  "example": {
    "title": "经典案例 · Supercell 的加拿大软发布",
    "content": "Supercell 每一款游戏在全球发布前都会先在加拿大软发布 6-12 个月（包括 Clash of Clans、Brawl Stars）。原因：加拿大用户行为类似美国但市场小，能承受失败。Supercell 在加拿大软发布期 kill 掉的游戏数量是上线游戏的 4 倍——这种「敢杀产品」的纪律是他们维持高 ARPU 命中率的核心。"
  },
  "bookmarks": [],
  "stats": {
    "usedInProjects": [],
    "useCount": 0
  },
  "createdAt": "2026-04-07T00:00:00Z",
  "updatedAt": "2026-04-08T10:59:53.259Z",
  "kind": "methodology"
}
