{
  "id": "atom_bounded_rationality",
  "schemaVersion": 1,
  "kind": "methodology",
  "name": "有限理性",
  "nameEn": "Bounded Rationality",
  "frameworkId": "cognitive-psychology-basics",
  "cellId": "bounded-rationality",
  "tags": ["决策心理", "Herbert Simon", "满意即可", "认知负荷", "简化决策"],
  "coreIdea": "有限理性（Bounded Rationality）由诺贝尔奖得主 Herbert Simon 于 1955 年提出：人类不是经济学假设的「完全理性」决策者，而是在认知能力、信息获取和时间的约束下做出「足够好」的决策。Simon 将这种策略称为「满意即可」（Satisficing）——不追求最优解，而是设定一个可接受的阈值，找到第一个满足条件的选项即停止搜索。这不是偏误，而是在复杂世界中的进化适应。产品设计应该减少用户的决策负荷，而非提供更多选项。",
  "whenToUse": "产品功能取舍和简化设计 · 用户选择流程优化 · 定价套餐设计 · 信息架构简化 · 决策疲劳场景识别 · 默认值和推荐算法设计",
  "keySteps": [
    "识别用户的认知约束：时间压力、信息过载、专业知识不足",
    "评估当前决策复杂度：用户需要比较多少选项？每个选项有多少维度？",
    "设计「满意即可」路径：提供智能默认值、推荐选项或分步引导",
    "减少选项数量：用渐进式展示替代一次性呈现所有选择",
    "简化比较维度：突出 2-3 个关键差异，而非展示完整参数表",
    "设置合理的默认值：让「不做选择」本身就是一个好选择",
    "验证简化效果：测量决策时间、满意度和后悔率"
  ],
  "aiSkillPrompt": "你是一位精通 Herbert Simon 有限理性理论和 Gerd Gigerenzer 启发式决策研究的认知设计顾问。请按以下流程帮助我简化用户决策：\n\n## 输入\n{请在此处填入：用户面临的决策场景、当前可选项数量和维度、用户的典型时间压力和专业水平、决策后的后果严重程度}\n\n## 任务\n1. 认知负荷评估：计算当前决策的复杂度——选项数 × 比较维度数 × 不确定性程度，判断是否超出用户的认知处理能力\n2. 满意化策略设计：\n   - 为用户设定合理的「足够好」阈值（什么条件算满意？）\n   - 设计搜索终止规则（什么时候可以停止比较？）\n   - 将复杂的多维度比较简化为 1-2 个关键决策点\n3. 选择架构优化：\n   - 默认值设计：如果用户不做选择，什么是最合理的默认？\n   - 推荐逻辑：基于什么条件推荐哪个选项？\n   - 渐进式展示：先做大决策，再做小决策（漏斗式）\n4. 决策辅助工具：设计帮助用户快速做出「足够好」决策的辅助信息\n\n## 输出格式\n章节 1：认知负荷诊断（当前复杂度评分 + 瓶颈分析）。章节 2：简化方案（Before/After 对比）。章节 3：默认值和推荐逻辑设计。章节 4：验证指标。\n\n## 约束\n- 简化不等于隐藏——用户需要的信息仍然可以找到，只是不在第一层展示\n- 默认值必须对用户有利，不能为了商业利益设置损害用户的默认值\n- 区分「低风险决策」（可以大胆简化）和「高风险决策」（需要保留充分信息）\n- 引用具体的认知负荷研究数据作为设计依据",
  "example": {
    "title": "案例：Netflix 的「为你推荐」如何利用有限理性",
    "content": "Netflix 有超过 15000 部内容，如果让用户从完整目录中选择，决策瘫痪几乎是必然的。Netflix 的解决方案完美体现了有限理性设计：个性化推荐（将 15000 缩减到首页 40-50 部）、分类行（降低搜索空间）、Top 10 榜单（社会证明作为启发式）、自动播放预览（降低「点击观看」的决策门槛）、「继续观看」置顶（让最简单的选择最容易触达）。结果：用户平均 90 秒内就做出观看决策，远快于竞品。"
  },
  "bookmarks": [],
  "stats": {
    "usedInProjects": [],
    "useCount": 0,
    "aiInvokeCount": 0,
    "humanViewCount": 0
  },
  "createdAt": "2026-04-14T00:00:00Z",
  "updatedAt": "2026-04-14T00:00:00Z"
}
