{
  "id": "atom_sunk_cost_fallacy",
  "schemaVersion": 1,
  "kind": "methodology",
  "name": "沉没成本谬误",
  "nameEn": "Sunk Cost Fallacy",
  "frameworkId": "cognitive-psychology-basics",
  "cellId": "cognitive-biases",
  "tags": ["认知偏误", "决策", "项目管理", "投资", "损失厌恶"],
  "coreIdea": "沉没成本谬误（Sunk Cost Fallacy）是指人们在做决策时，过度考虑已经投入且无法收回的成本（时间、金钱、精力），而非未来的预期收益。Arkes 和 Blumer（1985）的经典实验证明，人们会继续看一部不好看的电影、吃一份不好吃的饭，仅仅因为「已经付了钱」。在产品和项目管理中，沉没成本谬误是「僵尸项目」的根源——团队明知项目前景不好，却因为「已经投入了 6 个月」而不愿止损。理性决策应该只看未来的增量成本和收益。",
  "whenToUse": "项目继续/终止决策 · 功能下线评估 · 技术栈迁移讨论 · 个人职业转型决策 · 投资组合复盘 · Sprint 回顾中的取舍讨论",
  "keySteps": [
    "识别决策中的「已投入」论据——任何以「我们已经花了 X」开头的理由",
    "分离沉没成本和前瞻成本：过去的投入归零，只计算从今天开始的成本",
    "假设清零测试：如果从今天开始全新决策，你还会选择同样的方向吗？",
    "计算继续成本：不止损的代价是什么？机会成本有多大？",
    "引入外部视角：让不了解历史投入的人独立评估当前选项",
    "建立预设止损点：在项目启动时就定义「如果到 X 时间没达到 Y 指标就终止」",
    "复盘学习：从沉没项目中提炼可复用的知识和经验"
  ],
  "aiSkillPrompt": "你是一位精通行为经济学和项目管理决策的沉没成本审计员。请按以下流程帮助我做出理性的继续/终止决策：\n\n## 输入\n{请在此处填入：项目/功能/投资的名称、已投入的资源（时间/金钱/人力）、当前面临的继续/终止/转向选择、犹豫不决的原因}\n\n## 任务\n1. 沉没成本盘点：列出所有已投入且无法收回的成本，明确标注「这些成本无论你如何选择都无法收回」\n2. 前瞻分析：只看未来——继续投入需要多少额外成本？预期能获得什么回报？成功概率是多少？\n3. 清零测试：假设你今天刚加入团队，对历史投入一无所知，面对同样的市场状况和资源，你会选择这个方向吗？\n4. 机会成本计算：如果把接下来要投入的资源用于最佳替代方案，预期收益是多少？\n5. 情感解耦：识别影响决策的非理性因素——面子、承诺一致性、团队情感、对「浪费」的恐惧\n6. 止损建议：给出明确的决策建议，如果建议终止，提供一个体面的收尾方案\n\n## 输出格式\n章节 1：沉没成本清单（表格：项目 | 已投入 | 可回收性）。章节 2：前瞻成本收益分析。章节 3：清零测试结论。章节 4：机会成本对比。章节 5：决策建议（继续/终止/转向）+ 行动计划。\n\n## 约束\n- 不允许用「已经投入了 X 所以不能放弃」作为继续的理由\n- 必须诚实评估成功概率，不能因为想安慰用户而美化前景\n- 如果建议终止，必须同时给出「从失败中学到什么」的复盘框架\n- 承认情感因素的存在，但帮助用户将情感和决策分离",
  "example": {
    "title": "案例：花了 18 个月的内部工具要不要继续",
    "content": "某公司花了 18 个月和 200 万开发内部 CRM 系统，但上线后使用率只有 15%，用户反馈体验远不如 Salesforce。产品总监在汇报中说「我们已经投入了这么多，不能说放弃就放弃」。CEO 引入外部顾问做清零测试：如果今天从零开始，你会选择自建 CRM 还是买 Salesforce？答案显而易见是后者。最终决定迁移到 Salesforce（年费 30 万），将团队释放出来做核心业务功能。6 个月后，核心业务功能带来的收入增长远超 CRM 项目的全部投入。"
  },
  "bookmarks": [],
  "stats": {
    "usedInProjects": [],
    "useCount": 0,
    "aiInvokeCount": 0,
    "humanViewCount": 0
  },
  "createdAt": "2026-04-14T00:00:00Z",
  "updatedAt": "2026-04-14T00:00:00Z"
}
