{
  "id": "atom_deep_interview",
  "schemaVersion": 1,
  "name": "深度访谈",
  "nameEn": "Deep Interview",
  "frameworkId": "product-innovation-24",
  "cellId": 2,
  "tags": [
    "访谈",
    "定性研究",
    "用户研究",
    "倾听"
  ],
  "parentAtomId": "atom_voc_overview",
  "relationType": "child",
  "coreIdea": "深度访谈不是「问问题」，是「引导用户讲故事」。真正有效的访谈 80% 时间用户在说，PM 只做三件事：抛开场问题、用沉默等待、追问具体细节。一旦用户开始说「我通常会……」就已经失败——你要让他说「上一次我是这么做的」。",
  "whenToUse": "新用户群 · 颠覆式创新项目的早期 · 问卷数据反直觉需要解释时 · 访谈 5-8 位用户后做需求合成 · 任何你不确定自己假设是否成立的时候",
  "keySteps": [
    "1. 明确研究问题（想知道什么），每场访谈只聚焦 1-2 个问题",
    "2. 招募符合条件的真实用户（付费、同细分、近期有过相关行为）",
    "3. 设计 5-7 个开放主问题，围绕「过去经历 → 行为 → 情绪 → 替代方案」",
    "4. 访谈现场：先建立信任（3 分钟暖场），然后引导到一次具体经历",
    "5. 遇到抽象答案立即追问「能不能说一次具体的？」「那一次发生了什么？」",
    "6. 录音 + 逐字稿，整理成「事实 / 引用 / 情绪 / 推论」四栏笔记",
    "7. 访谈 5-6 场后做跨场合成，找重复出现的模式"
  ],
  "aiSkillPrompt": "你是一位专门培训 PM 做用户访谈的资深研究教练（参考 Erika Hall / Steve Portigal 学派）。请按以下流程生成一份可立即执行的深度访谈计划：\n\n## 输入\n{请在此处填入：研究问题（你想搞清楚的 1-2 件事）+ 目标用户描述 + 可访谈的时间和预算}\n\n## 任务\n1. 把我的研究问题翻译成 2-3 个「可被访谈回答」的具体子问题\n2. 生成招募筛选问卷（5-7 条），确保招到真实发生过相关行为的人，而不是「可能会」的人\n3. 设计一份 45 分钟访谈脚本：\n   - 0-3 分钟 暖场（让用户放松 + 建立授权）\n   - 3-10 分钟 背景问题（了解用户上下文）\n   - 10-35 分钟 核心问题（围绕一次具体经历展开，用「讲故事」结构）\n   - 35-43 分钟 追问与深挖\n   - 43-45 分钟 收尾（「我还有什么没问但你觉得重要的？」）\n4. 给出 8 个「追问金句」，用于用户抽象回答时的即时追问\n5. 给出访谈笔记模板（事实 / 原话 / 情绪 / 推论 四栏）\n6. 提示 5 个最容易翻车的禁区（诱导性问题、功能验证、假设性问题、总结用户话、多人访谈）\n\n## 输出格式\n章节 1：子问题翻译。章节 2：招募问卷。章节 3：访谈脚本（严格按时间轴）。章节 4：追问金句。章节 5：笔记模板。章节 6：禁区清单。\n\n## 约束\n- 所有主问题必须是「过去时」，禁止「你会不会…」「如果…你觉得…」\n- 禁止出现「你觉得我们这个产品怎么样」这类验证式问题\n- 脚本中必须有至少 2 处明确提示「沉默 5 秒等用户补充」\n- 全文不超过 1500 字",
  "example": {
    "title": "经典案例 · Intercom 的 5 位用户访谈原则",
    "content": "Intercom 产品团队在做任何大功能前都坚持访谈 5 位真实用户。他们发现第 6 位开始新洞察骤减、但前 5 位往往足以暴露 80% 的关键问题。有一次他们准备做一个「更智能的收件箱」，访谈 5 位支持主管后发现真问题根本不是「智能」——而是「我没法知道哪些对话被我的团队漏掉了」。产品方向立即从 AI 优先级排序改为团队协作视图，上线后留存提升 40%。"
  },
  "bookmarks": [],
  "stats": {
    "usedInProjects": [],
    "useCount": 0
  },
  "createdAt": "2026-04-07T00:00:00Z",
  "updatedAt": "2026-04-08T10:59:53.234Z",
  "kind": "methodology"
}
