{
  "id": "atom_nav_patterns",
  "schemaVersion": 1,
  "kind": "methodology",
  "name": "导航模式",
  "nameEn": "Navigation Patterns",
  "frameworkId": "ui-ux-patterns",
  "cellId": "information-architecture",
  "tags": ["导航", "信息架构", "IA", "用户体验", "可发现性"],
  "coreIdea": "导航模式是信息架构的骨架，决定了用户如何在产品中移动和寻路。核心导航模式包括：层级导航（Hierarchical）——适合内容深度大的应用，如设置页面；扁平导航（Flat/Tab）——适合功能并列的场景，如底部 Tab Bar；Hub-and-Spoke——适合任务独立的工具型产品；搜索优先——适合内容量巨大且用户目标明确的场景。选择导航模式的关键不是美观，而是匹配用户的心智模型：用户期望在哪里找到什么？导航的终极目标是让用户「不需要思考自己在哪」。",
  "whenToUse": "产品从0到1的信息架构设计 · 功能增多后需要重构导航 · 用户反馈「找不到功能」 · 移动端和桌面端导航适配 · 评审已有产品的可发现性问题",
  "keySteps": [
    "盘点所有功能和内容，按用户任务（而非内部组织架构）分组",
    "通过卡片分类法（Card Sorting）验证分组是否匹配用户心智模型",
    "根据内容层级深度和功能并列度选择主导航模式",
    "设计导航层级：全局导航（永远可见）→ 局部导航（上下文相关）→ 辅助导航（面包屑、搜索）",
    "为每个导航项选择清晰的标签（避免内部术语）",
    "用原型测试：5秒测试（用户能否快速定位目标功能）",
    "根据测试结果迭代调整层级和标签"
  ],
  "aiSkillPrompt": "你是一位精通 Jakob Nielsen 可用性原则和 Steve Krug「Don't Make Me Think」理念的信息架构顾问。请按以下流程帮助我设计或优化产品导航：\n\n## 输入\n{请在此处填入：产品类型和核心功能清单、目标用户角色、当前导航结构（如有）、用户反馈的导航痛点}\n\n## 任务\n1. 功能盘点：将所有功能和内容按用户任务（而非内部组织架构）分组，标注使用频率（高频/中频/低频）\n2. 心智模型分析：基于用户角色推断其期望的信息组织方式，识别可能的分类冲突\n3. 导航模式推荐：根据内容层级深度、功能并列度、使用频率分布，推荐主导航模式——层级导航 / 扁平 Tab / Hub-and-Spoke / 搜索优先，给出选择理由\n4. 层级规划：设计三级导航结构——全局导航（永远可见）→ 局部导航（上下文相关）→ 辅助导航（面包屑/搜索/快捷入口）\n5. 标签命名：为每个导航项建议清晰的标签，避免内部术语，确保 5 秒可理解\n6. 验证方案：设计卡片分类法或树形测试的具体步骤，验证导航是否匹配用户心智模型\n\n## 输出格式\n章节 1：功能分组矩阵（任务 | 功能 | 频率）。章节 2：导航模式评估（对比表：模式 | 适用条件 | 本产品匹配度）。章节 3：导航结构树（缩进列表，标注层级）。章节 4：标签方案。章节 5：验证计划。\n\n## 约束\n- 导航设计必须「任务驱动」而非「功能罗列」\n- 全局导航项不超过 7±2 个（Miller 定律）\n- 移动端和桌面端需分别考虑导航适配方案\n- 每个建议需引用具体的可用性原则（Nielsen/Norman/Krug）",
  "example": {
    "title": "案例：SaaS 工具从侧边栏到顶部 Tab 的导航重构",
    "content": "一个项目管理 SaaS 最初用深层级侧边栏导航，功能不断增加后侧边栏有3级嵌套，用户频繁迷路。通过卡片分类发现用户将功能分为5个并列的工作区域（项目/日历/文档/团队/报告），于是改为顶部 Tab 扁平导航 + 每个 Tab 内的局部侧边栏。重构后功能可发现性提升40%，新用户首次完成核心任务的时间缩短了60%。"
  },
  "bookmarks": [],
  "stats": {
    "usedInProjects": [],
    "useCount": 0,
    "aiInvokeCount": 0,
    "humanViewCount": 0
  },
  "createdAt": "2026-04-11T00:00:00Z",
  "updatedAt": "2026-04-14T00:00:00Z"
}
