{
  "id": "atom_eisenhower_matrix",
  "schemaVersion": 1,
  "name": "艾森豪威尔矩阵",
  "nameEn": "Eisenhower Matrix",
  "frameworkId": "product-innovation-24",
  "cellId": 4,
  "tags": [
    "艾森豪威尔",
    "紧急重要",
    "优先级",
    "2x2"
  ],
  "parentAtomId": "atom_demand_filtering_toolkit",
  "relationType": "child",
  "coreIdea": "把需求放在「紧急 × 重要」的 2×2 矩阵里，四象限决定命运：重要且紧急立即做、重要不紧急排计划、紧急不重要授权或简化、不重要不紧急砍掉。PM 最常犯的错是把「第三象限」的紧急琐事当成工作的全部——而真正决定产品命运的是「第二象限」里那些没人催的事。",
  "whenToUse": "产品待办列表严重膨胀时的粗筛 · PM 个人每周待办管理 · 突然袭来的紧急需求判断是否真的紧急 · 组织过载时的分派决策 · 与上级对齐「我为什么这周不做你昨天要的那个」",
  "keySteps": [
    "1. 把本周 / 本迭代所有待办写成便签",
    "2. 先判重要（会不会影响产品关键结果 / OKR）",
    "3. 再判紧急（是否有外部不可移动的 deadline）",
    "4. 放入四象限：Q1 做 / Q2 排 / Q3 授权 / Q4 砍",
    "5. 强制约束 Q1 数量 ≤ 总数 20%；如果超了就是计划不良",
    "6. 把 Q4 删掉并公告——不要让砍掉的事情还留在 backlog",
    "7. 每周回看 Q2，这才是真正决定产品未来的部分"
  ],
  "aiSkillPrompt": "你是一位熟悉时间管理原则、精通 Stephen Covey《高效能人士的七个习惯》第三象限理论的产品教练。请按以下流程执行：\n\n## 输入\n{请在此处填入：当前待办清单（需求 / 会议 / bug / 响应请求混合都可以）+ 本季度产品核心目标 / OKR + 本周 deadline 约束}\n\n## 任务\n1. 对每条待办判断两个维度：\n   - 重要性：它对本季度核心目标的贡献大不大（1-5 分，给出理由）\n   - 紧急性：它是否有不可移动的外部 deadline（1-5 分，给出理由）\n2. 将待办映射到四象限：\n   - Q1 重要且紧急 → 立即做\n   - Q2 重要不紧急 → 排计划，给出建议开始时间\n   - Q3 紧急不重要 → 授权 / 简化 / 拒绝，建议由谁代替\n   - Q4 不重要不紧急 → 砍，并给出删除理由\n3. 校验 Q1 占比是否 ≤ 20%，如果超出则说明「哪些被误判为重要」或「哪些被误判为紧急」，给出降级建议\n4. 对 Q2 单独输出「本周必须为它分配多少时间」的建议——这是大多数 PM 的盲区\n5. 对 Q3 的每一条生成一句可以直接发给请求方的回话术（礼貌地推掉或转交）\n\n## 输出格式\n章节 1：待办打分表。章节 2：四象限清单（四段 Markdown 列表）。章节 3：Q1 占比校验。章节 4：Q2 时间分配建议。章节 5：Q3 回话术清单。\n\n## 约束\n- 不允许把所有待办都打成「重要」——必须严格挂钩本季度核心目标\n- Q4 必须至少有 1 条——如果为空，说明你没敢砍\n- 禁止把「老板临时要」自动判定为 Q1\n- 全文不超过 1200 字",
  "example": {
    "title": "经典案例 · 艾森豪威尔本人的使用逻辑",
    "content": "美国第 34 任总统艾森豪威尔在任期间说过一句被广泛引用的话：「重要的事很少紧急，紧急的事很少重要。」他把白宫每天收到的数百份请示分为四类，自己只处理第二象限的战略决策（冷战布局、州际公路法案），把第一象限授权给国务卿，第三象限转给参谋长。这个习惯让他能在副总统时期和总统两届任内都准时下班打高尔夫——不是偷懒，而是因为他确信授权和拒绝才是领导力的核心。PM 不是总统，但待办管理的本质是一样的。"
  },
  "bookmarks": [],
  "stats": {
    "usedInProjects": [],
    "useCount": 0
  },
  "createdAt": "2026-04-07T00:00:00Z",
  "updatedAt": "2026-04-08T10:59:53.237Z",
  "kind": "methodology"
}
