{
  "id": "atom_digital_prototype",
  "schemaVersion": 1,
  "kind": "methodology",
  "name": "数字交互原型",
  "nameEn": "Digital Interactive Prototype",
  "frameworkId": "design-thinking-5",
  "cellId": 4,
  "tags": [
    "设计思维",
    "原型",
    "数字原型",
    "Figma",
    "高保真"
  ],
  "coreIdea": "数字交互原型是设计思维 Prototype 阶段的高保真验证工具，使用 Figma、Sketch、Framer 等数字工具构建可点击的模拟产品。Bill Buxton 在《Sketching User Experiences》中将其定位为「用最低成本让利益相关者体验未来产品」的关键手段。核心哲学：原型的目的不是展示最终设计，而是「让假设具象化，让讨论有的放矢」。数字原型比纸面原型能验证更细致的交互细节——动效、转场、微交互——这些细节往往决定了用户体验的好坏。之所以有效，是因为它在「纸面原型太粗糙」和「真实开发太昂贵」之间找到了最佳平衡点。",
  "whenToUse": "纸面原型已验证核心流程需要更精细的交互验证 · 需要进行远程可用性测试（纸面原型无法远程） · 需要向投资人或高管展示接近真实的产品体验",
  "keySteps": [
    "1. 确定原型范围：只做需要验证的核心流程（不做完整产品）",
    "2. 定义保真度级别：低保真（灰框线框图）、中保真（品牌色+真实内容）、高保真（视觉完稿+动效）",
    "3. 在 Figma/Sketch 中构建界面——优先使用组件库提速",
    "4. 添加交互：页面跳转、状态切换、微交互（用 Smart Animate 等）",
    "5. 填入真实内容（真实文案、真实数据、真实图片）——假内容导致假反馈",
    "6. 内部走查：团队成员以用户身份走完所有任务流",
    "7. 用户测试：通过链接分享给测试用户，收集任务完成率和反馈"
  ],
  "aiSkillPrompt": "你是一位精通 Figma 原型设计和 Bill Buxton 体验草图理论的原型设计教练。请按以下流程帮助我：\n\n## 输入\n{请提供：产品概念描述、需要验证的核心用户任务流、保真度需求（低/中/高）、目标设备（移动端/桌面端）}\n\n## 任务\n1. 制定原型规划：\n   - 界面清单（含所有状态：默认、加载、空状态、错误、成功）\n   - 交互流程图（界面间跳转关系）\n   - 保真度策略（哪些界面高保真、哪些低保真）\n2. 为每个界面提供设计规格：\n   - 信息架构（内容层级和优先级）\n   - 关键交互点（点击区域、手势、动效描述）\n   - 需要注意的可用性原则（Fitts Law、Miller's Law 等）\n3. 设计测试方案：\n   - 任务脚本（自然语言任务描述）\n   - 成功标准（任务完成率、完成时间、错误率）\n   - 观察记录模板\n4. 提供原型制作的效率建议\n\n## 输出格式\n章节 1：原型规划文档。章节 2：界面设计规格。章节 3：测试方案。章节 4：效率建议。\n\n## 约束\n- 原型范围不超过 15 个界面\n- 必须包含错误状态和边界情况的处理\n- 测试任务不能暗示操作路径",
  "example": {
    "title": "案例：Dropbox 用高保真原型验证协作功能需求",
    "content": "Dropbox 在 2017 年推出 Paper（协作文档工具）前，团队用 Figma 制作了一个包含 45 个界面状态的高保真交互原型。原型覆盖了从创建文档到多人实时协作的完整流程，甚至模拟了网络延迟时的加载状态。通过对 30 位目标用户的远程原型测试，团队发现了一个关键洞察：用户最大的焦虑不是「功能够不够」而是「我的编辑会不会覆盖别人的内容」。基于此，团队优先开发了「编辑冲突可视化提示」功能，上线后协作文档的活跃度比预期高出 40%。"
  },
  "bookmarks": [],
  "stats": {
    "usedInProjects": [],
    "useCount": 0,
    "aiInvokeCount": 0,
    "humanViewCount": 0
  },
  "createdAt": "2026-04-14T00:00:00Z",
  "updatedAt": "2026-04-14T00:00:00Z"
}
