{
  "id": "atom_lotus_blossom",
  "schemaVersion": 1,
  "name": "莲花图 Lotus Blossom",
  "nameEn": "Lotus Blossom",
  "frameworkId": "product-innovation-24",
  "cellId": 9,
  "tags": [
    "莲花图",
    "发散",
    "结构化创意",
    "九宫格"
  ],
  "parentAtomId": "atom_ideation_explosion_overview",
  "relationType": "child",
  "coreIdea": "九宫格中央放主题，外围八格写八个相关方向；每个方向再成为新九宫格的中心继续发散——一层 9 个、二层 64 个，强制把模糊主题展开成可操作的细叶。",
  "whenToUse": "主题宏大时（如'让产品更社交'）· 需要系统性而非灵感型发散 · 战略主题分解 · 个人深度思考",
  "keySteps": [
    "把核心主题写在中心格",
    "围绕中心写出 8 个相关子主题（迫使自己写满 8 个）",
    "把每个子主题搬到外围 8 个新九宫格的中心",
    "每个新九宫格再发散 8 个具体想法",
    "总共得到 64 个候选，按主题着色聚类",
    "选 8-10 个最具潜力的想法进入筛选"
  ],
  "aiSkillPrompt": "你是一位精通莲花图（Lotus Blossom，也称 MY 法）的创新教练。我将提供一个宏观主题，请你帮我完成两层九宫格发散。\n\n## 输入\n- 核心主题：{请在此处填入}\n- 业务背景：{请在此处填入}\n- 我希望发散得到的产出类型（功能/策略/场景/...）：{请在此处填入}\n\n## 任务\n1. 输出第一层九宫格：核心主题在中心，外围 8 个子主题（必须填满 8 个，不允许留空）\n2. 对每个子主题再展开二层九宫格，得到 8 个具体想法（共 64 个）\n3. 对 64 个想法按潜力打 ⭐ 1-3 颗\n4. 提取 3 个最具反直觉的想法并解释为什么\n\n## 输出格式\n```\n## 第一层（中心 + 8 个方向）\n| 左上 | 上 | 右上 |\n| 左 | 【主题】 | 右 |\n| 左下 | 下 | 右下 |\n\n## 第二层 × 8\n### 子主题 1: <名称>\n| ... |（同样的 3x3 表，中心是子主题）\n\n## 推荐 Top 3 反直觉想法\n```\n\n## 约束\n- 二层每个想法必须可单句描述具体动作\n- 不允许写'其它''待补充'\n- 8 个子主题之间应尽量正交，不要重复",
  "example": {
    "title": "丰田用莲花图开发普锐斯",
    "content": "丰田工程团队曾以'21 世纪汽车'为中心写莲花图，外围发散出'燃油效率''零排放''小型化'等 8 个方向，再二层展开后得到 64 个具体技术路线，最终聚焦混合动力诞生了 Prius。"
  },
  "bookmarks": [],
  "stats": {
    "usedInProjects": [],
    "useCount": 0
  },
  "createdAt": "2026-04-07T00:00:00Z",
  "updatedAt": "2026-04-08T10:59:53.251Z",
  "kind": "methodology"
}
