{
  "id": "atom_porter_five_forces",
  "schemaVersion": 1,
  "name": "波特五力模型",
  "nameEn": "Porter's Five Forces",
  "frameworkId": "product-innovation-24",
  "cellId": 5,
  "tags": [
    "五力模型",
    "行业结构",
    "议价权",
    "进入壁垒"
  ],
  "parentAtomId": "atom_competitor_analysis_overview",
  "relationType": "child",
  "coreIdea": "看清一个赛道是否值得进，不看竞品多少，看 5 股力把利润挤到哪里去了。利润流向决定战略选择。",
  "whenToUse": "评估是否进入新赛道 · 判断现有赛道是否仍然性感 · 解释为什么自己越做越累却没钱 · 投资人尽调",
  "keySteps": [
    "供应商议价能力：上游集中度、切换成本",
    "购买者议价能力：下游集中度、信息透明度",
    "新进入者威胁：壁垒、规模经济、品牌锁定",
    "替代品威胁：跨品类替代、技术降维",
    "现有竞争强度：增速、退出壁垒、同质化",
    "综合评估利润流向并给出战略建议"
  ],
  "aiSkillPrompt": "你是一位行业分析师，擅长用波特五力模型解释一个赛道的利润结构。我将提供我所在的行业和角色，请你做一次五力扫描并给出战略含义。\n\n## 输入\n- 行业名称与细分：{请在此处填入}\n- 我所处的位置（哪个环节）：{请在此处填入}\n- 已知的关键玩家与价格信号：{请在此处填入}\n\n## 任务\n1. 对 5 股力分别打『高/中/低』，并写 1 条最关键证据\n2. 说明利润目前被哪股力『吸走』\n3. 推断未来 2 年最可能恶化的力\n4. 提出 2 个战略选择：『顺势』和『破局』\n5. 给出 1 句话结论：这个赛道现在该进、该熬、还是该撤\n\n## 输出格式\nMarkdown 表格（5 行 × 3 列：力 / 评级 / 证据）+ 3 段简短分析\n\n## 约束\n- 评级必须有具体证据支撑，禁止主观直觉\n- 战略建议必须是动词开头的可执行动作\n- 不要写『加强创新』『提升服务』这种万能废话",
  "example": {
    "title": "中国共享单车赛道 2017 五力诊断",
    "content": "供应商（自行车厂）议价能力低，但购买者（用户）议价能力极高（一键切换 App），新进入者壁垒在融资战中接近零。结论：利润根本留不下，唯一战略是『烧到只剩一家』——果然只剩两家半。"
  },
  "bookmarks": [],
  "stats": {
    "usedInProjects": [],
    "useCount": 0
  },
  "createdAt": "2026-04-07T00:00:00Z",
  "updatedAt": "2026-04-08T10:59:53.243Z",
  "kind": "methodology"
}
