{
  "id": "atom_think_aloud_protocol",
  "schemaVersion": 1,
  "kind": "methodology",
  "name": "出声思维法",
  "nameEn": "Think-Aloud Protocol (Ericsson & Simon)",
  "frameworkId": "design-thinking-5",
  "cellId": 5,
  "tags": [
    "设计思维",
    "出声思维",
    "Ericsson & Simon",
    "认知过程",
    "可用性"
  ],
  "coreIdea": "由认知心理学家 K. Anders Ericsson 和 Herbert Simon 在 1980 年代系统化的研究方法，后被 Jakob Nielsen 引入可用性测试领域。核心操作：让用户在执行任务时持续说出自己的想法——「我在想...」「我以为...」「我找不到...」。核心哲学：用户的行为告诉你「what」（做了什么），出声思维告诉你「why」（为什么这么做）。它是唯一能实时捕捉用户认知过程的方法，比事后回忆准确得多。之所以有效，是因为它让设计者「钻进用户的脑子里」——当你听到用户说「这个图标应该是设置吧...等等，不对...」时，你立刻知道信息架构出了问题。",
  "whenToUse": "可用性测试中需要理解用户操作背后的思维过程 · 界面的可发现性（Discoverability）需要验证 · 需要理解用户的心智模型和预期",
  "keySteps": [
    "1. 向用户解释出声思维：「请把你的想法说出来，就像自言自语一样」",
    "2. 做一个练习任务让用户适应出声思维（如：在线买一本书）",
    "3. 开始正式任务，提醒用户持续说出想法",
    "4. 如果用户沉默超过 15 秒，轻声提醒：「你现在在想什么？」",
    "5. 记录三层数据：行为（做了什么）、言语（说了什么）、情绪（语气/表情）",
    "6. 任务结束后进行回顾访谈：回放关键片段请用户补充",
    "7. 分析认知模式：在哪里出现了「预期vs现实」的偏差"
  ],
  "aiSkillPrompt": "你是一位精通 Ericsson & Simon 出声思维协议和 Nielsen 可用性方法论的用户测试教练。请按以下流程帮助我：\n\n## 输入\n{请提供：产品/原型描述、测试任务（1-3个）、你希望验证的设计假设}\n\n## 任务\n1. 设计出声思维测试方案：\n   - 向用户解释出声思维的标准话术\n   - 练习任务设计（让用户适应边做边说）\n   - 正式任务脚本（含自然语言任务描述）\n2. 制定数据记录框架：\n   - 三列同步记录模板：时间戳 | 行为（做了什么）| 言语（说了什么）| 推断（可能在想什么）\n   - 关键信号标注规则（困惑、惊喜、挫败、自信）\n   - 沉默处理策略（何时提醒、如何提醒）\n3. 设计分析框架：\n   - 认知偏差识别（预期 vs 现实的 Gap 分析）\n   - 心智模型映射（用户以为系统如何工作 vs 实际如何工作）\n   - 可发现性评分（用户能否自主找到功能）\n4. 输出改进建议（按认知负荷优先级排序）\n\n## 输出格式\n章节 1：测试方案（含话术模板）。章节 2：记录框架。章节 3：分析框架。章节 4：改进建议模板。\n\n## 约束\n- 提醒话术必须中性，禁止引导用户思考方向\n- 推断列必须标注为「推断」，与用户原话明确区分\n- 每次测试不超过 45 分钟（出声思维比普通测试更消耗认知资源）",
  "example": {
    "title": "案例：Google 用出声思维优化搜索结果页",
    "content": "Google 搜索团队在 2010 年代对搜索结果页进行出声思维测试时发现了一个关键洞察：用户在说「我在找...」时的心智模型和搜索算法的逻辑完全不同。用户不是在「搜索关键词」，而是在「问一个问题并期望直接答案」。一位用户在搜索「纽约天气」时说：「我不想看天气网站的链接，我就想知道现在几度。」这个出声思维的直接引述推动了 Google Knowledge Panel（知识面板）的优先开发。上线后搜索满意度提升了 12%，用户点击搜索结果的需求减少了 20%——因为答案已经直接展示在搜索页面上了。"
  },
  "bookmarks": [],
  "stats": {
    "usedInProjects": [],
    "useCount": 0,
    "aiInvokeCount": 0,
    "humanViewCount": 0
  },
  "createdAt": "2026-04-14T00:00:00Z",
  "updatedAt": "2026-04-14T00:00:00Z"
}
